Ses01F_impro05_M012	 for such an inconvenience and your bag, but	Ses01F-impro05-01-01-M012.wav	01
Ses03M_impro06_F020	 Now I can't.	Ses03M-impro06-04-01-F020.wav	04
Ses02M_impro05_F009	 Okay	Ses02M-impro05-01-01-F009.wav	01
Ses05M_impro07_F030	 yeah.	Ses05M-impro07-01-01-F030.wav	01
Ses03F_impro07_F028	 Yeah. I'll get like one of those little--	Ses03F-impro07-07-01-F028.wav	07
Ses03F_script01_1_M018	 I want to ask her to marry me.	Ses03F-script01-01-01-1_M018.wav	01
Ses01M_impro04_M014	 What?	Ses01M-impro04-05-01-M014.wav	05
Ses02F_impro08_F006	 um lots of purchases, but we're gonna go ahead and give that to you anyway. uh,  Just to make sure that you're happy with your service here.	Ses02F-impro08-01-01-F006.wav	01
Ses04M_impro01_F018	 So go get in the other line or leave.  Or I will have you escorted out by security.	Ses04M-impro01-05-01-F018.wav	05
Ses03F_script02_1_M003	 Oh, is that-is that-now, is that just foam, uhh, I can't even tell.	Ses03F-script02-07-01-1_M003.wav	07
Ses05F_script01_3_F023	 Oh gee.	Ses05F-script01-04-01-3_F023.wav	04
Ses03M_impro05b_F003	 Okay.  Let's look up here	Ses03M-impro05b-01-01-F003.wav	01
Ses03F_script02_2_M001	 About what I was just saying.	Ses03F-script02-01-01-2_M001.wav	01
Ses03M_impro06_M015	 and the kids are paralyzed in a coma right now.	Ses03M-impro06-04-01-M015.wav	04
Ses03M_impro04_M000	 I'm just so tired all the time.	Ses03M-impro04-04-01-M000.wav	04
Ses04F_impro04_F015	 extreme request.  I want to find a job.  Everybody wants to find a job. It's really not that.	Ses04F-impro04-05-01-F015.wav	05
Ses04M_script01_3_M030	 And I got this idea watching them go down, everything was being destroyed, see?  But, to me, it seemed there was one new thing that was made,	Ses04M-script01-04-01-3_M030.wav	04
Ses05M_impro08_F011	 Well, I- I can check that.  Is there anything else we can do, too?  Like, I'll go through and check the line throughout the house, but --	Ses05M-impro08-01-01-F011.wav	01
Ses01M_script01_3_F014	 Everyday since.	Ses01M-script01-07-01-3_F014.wav	07
Ses03F_impro08_F003	 Sir, please calm down.  There's no reason to use profanity like that.  It's not-	Ses03F-impro08-01-01-F003.wav	01
Ses04F_script03_2_M035	 This is no time of year for Tunis.	Ses04F-script03-05-01-2_M035.wav	05
Ses02M_script02_1_M035	 There is that, oh no that's just seaweed, isn't it?	Ses02M-script02-07-01-1_M035.wav	07
Ses01M_impro06_F019	 It leaves a hole for you too, in your plans together.	Ses01M-impro06-01-01-F019.wav	01
Ses04F_script01_3_M014	 And he's gone forever.  You're sure?	Ses04F-script01-01-01-3_M014.wav	01
Ses05F_impro06_F008	 I know.	Ses05F-impro06-04-01-F008.wav	04
Ses03F_script01_2_M003	 How do you know he's even thinking about it?	Ses03F-script01-01-01-2_M003.wav	01
Ses03F_impro04_F022	 it's not funny. I just don't know what I'm going to do.	Ses03F-impro04-04-01-F022.wav	04
Ses05F_script03_1_F007	 Yes, I shall probably do a Court Curtsey.	Ses05F-script03-07-01-1_F007.wav	07
Ses02M_impro04_F005	 I understand that it's so frustrating but I know that you're here because you really want it you know and, and uh	Ses02M-impro04-01-01-F005.wav	01
Ses05M_script01_1_F026	 Well, the trouble is you never saw enough women.	Ses05M-script01-01-01-1_F026.wav	01
Ses03F_impro08_F015	 No, we don't just give you things.  We're- we're-	Ses03F-impro08-01-01-F015.wav	01
Ses03F_script02_1_M015	 I'm so stupid. I'm like a little kid. I-it's amazing I get out of the house with my fly zipped. Oh- [LAUGHTER].	Ses03F-script02-07-01-1_M015.wav	07
Ses05M_script03_2_F038	 Stop.  Would you just go away?  I mean, you're conceited, and overbearing, and utterly impossible.	Ses05M-script03-05-01-2_F038.wav	05
Ses04F_impro03_M036	 Well this is really exciting.  I mean- I just- I couldn't be happier right now.	Ses04F-impro03-07-01-M036.wav	07
Ses01M_script02_1_M010	 Of course, our flashlight.  What's your is mine, mi flashlight es su flashlight.	Ses01M-script02-01-01-1_M010.wav	01
Ses05F_script02_1_M031	 Somewhere out there, is a giant mass of silver fish all swimming in this direction.  They don't know why and we don't know why. They didn't get an invitation.  And it wasn't a vote- it wasn't a decision.  And nobody sent them a map or anything like that.	Ses05F-script02-07-01-1_M031.wav	07
Ses04F_script01_1_F019	 What do you want me to do?  You're old enough to know your own mind.	Ses04F-script01-05-01-1_F019.wav	05
Ses03F_impro03_F008	 goes up there and everyone's clapping and he's standing there and they put a spotlight on him.	Ses03F-impro03-07-01-F008.wav	07
Ses03F_impro08_F013	 -on average would use.	Ses03F-impro08-01-01-F013.wav	01
Ses01M_impro06_F014	 Mmhmm.	Ses01M-impro06-01-01-F014.wav	01
Ses01M_script02_2_M029	 What? Huh?	Ses01M-script02-01-01-2_M029.wav	01
Ses03M_impro06_M013	 And the car that he hit was his family.	Ses03M-impro06-04-01-M013.wav	04
Ses05F_script03_2_F014	 Just making myself fascinating for you.	Ses05F-script03-01-01-2_F014.wav	01
Ses05F_impro05_F004	 Right.	Ses05F-impro05-01-01-F004.wav	01
Ses01F_script02_2_F047	 Or not.	Ses01F-script02-01-01-2_F047.wav	01
Ses02F_script02_1_M015	 I can't believe I forgot.  I'm like a kid.  It's amazing I got out of the house with my fly zipped.	Ses02F-script02-07-01-1_M015.wav	07
Ses01M_impro05_F027	 What was that?	Ses01M-impro05-01-01-F027.wav	01
Ses05F_script01_1_M005	 I could hear him right through the floor of my room.	Ses05F-script01-04-01-1_M005.wav	04
Ses02M_impro08_F002	 it leads you around in circles, you can't, there is no way to like get to a real person if you don't already know how to get to there.	Ses02M-impro08-07-01-F002.wav	07
Ses04F_script02_2_F041	 somebody who knew how to enjoy herself and didn't take everything so hard.	Ses04F-script02-04-01-2_F041.wav	04
Ses02F_script01_1_M023	 She's not Larry's girl.	Ses02F-script01-05-01-1_M023.wav	05
Ses04F_impro02_M018	 That's all I'm saying... No you don't.	Ses04F-impro02-05-01-M018.wav	05
Ses01F_script02_1_F007	 How's that supposed to make me feel?	Ses01F-script02-05-01-1_F007.wav	05
Ses05F_script02_1_M003	 Oh no, you know what I did.  I forgot my flashlight.  How could I be so stupid?  I can't believe I forgot my flashlight.	Ses05F-script02-07-01-1_M003.wav	07
Ses03M_impro05b_F001	 Okay.  Well let's...well I'm going to go ahead and check on that for you.  You're coming from...where are you coming from?	Ses03M-impro05b-01-01-F001.wav	01
Ses05F_impro08_F024	 Well I'll give you my direct line and my number so you can- you can  get directly to me.	Ses05F-impro08-01-01-F024.wav	01
Ses04F_impro06_F005	 He was only twenty four and just so many things that we were going to do, you know, and now he won't get to do them and he won't get to be here when I do.  You know, like I'll get married some day and he won't be there, like, he won't get to see that.	Ses04F-impro06-04-01-F005.wav	04
Ses05M_script03_2_M042	 Oh, you're not going like this.	Ses05M-script03-05-01-2_M042.wav	05
Ses05F_script03_1_M013	 All the futile mortals who try to make life unbearable.  Laugh at them.  Be flippant.  Laugh at everything, all their sacred shibboleths.  Flippancy brings out the acid in their damned sweetness and light.	Ses05F-script03-07-01-1_M013.wav	07
Ses05M_script01_3_F013	 Well, I mean, until then you never wrote and when you did, what did you say?  I mean, you sure can be ambiguous.	Ses05M-script01-07-01-3_F013.wav	07
Ses02F_script03_2_M039	 Amanda, listen. listen	Ses02F-script03-05-01-2_M039.wav	05
Ses04M_script02_2_F028	 Oh, right, sure.  This is standing on the beach.   This is waiting.  This is fighting.	Ses04M-script02-05-01-2_F028.wav	05
Ses02M_impro01_M010	 It's standard? I mean I don't work at the D.M.V. how am I supposed to know that, like, I stand in line, I get my	Ses02M-impro01-05-01-M010.wav	05
Ses01M_script02_1_M045	 It's like urgency that's pure urge you know.  It's single-mindedness with no mind.	Ses01M-script02-07-01-1_M045.wav	07
Ses05F_impro06_M001	 Oh no, I'm so sorry. What happened?	Ses05F-impro06-04-01-M001.wav	04
Ses01F_impro03_M001	 Yeah.  I heard.	Ses01F-impro03-01-01-M001.wav	01
Ses04F_script03_2_M024	 Did you see much of Peter Burden after our divorce?	Ses04F-script03-01-01-2_M024.wav	01
Ses05F_impro08_F003	 I kwon, it is ridiculous	Ses05F-impro08-01-01-F003.wav	01
Ses02M_script01_1_F018	 Well, you want to make sure that your father isn't-	Ses02M-script01-01-01-1_F018.wav	01
Ses02M_impro05_F013	 they - they, it gets shipped to somewhere else and then it's stuck somewhere and then we have no way of tracking that.	Ses02M-impro05-01-01-F013.wav	01
Ses05F_impro02_M041	 I love you.	Ses05F-impro02-04-01-M041.wav	04
Ses04M_impro05_M011	 You understand?	Ses04M-impro05-05-01-M011.wav	05
Ses05M_impro07_M024	 Well, I don't know.  I've got to go look for a place.	Ses05M-impro07-07-01-M024.wav	07
Ses04F_script01_1_F042	 But don't think that way.  You hear me?	Ses04F-script01-05-01-1_F042.wav	05
Ses01F_script01_3_F015	 I almost got married two years ago.	Ses01F-script01-01-01-3_F015.wav	01
Ses02M_script01_1_F037	 Well, you don't want to think like that.	Ses02M-script01-05-01-1_F037.wav	05
Ses02F_script03_2_F025	 You're quite insufferable	Ses02F-script03-05-01-2_F025.wav	05
Ses02F_impro07_F017	 Because, I don't have to like make that decision anymore.  I don't have to try and decide, like, what the bad school I'm going to go to is. you know	Ses02F-impro07-07-01-F017.wav	07
Ses01F_impro02_F013	 You'll videotape everything, yeah?	Ses01F-impro02-04-01-F013.wav	04
Ses02M_script01_3_M034	 I mean, you can take those things out of a war, but when you drive that car, you've gotta realize that it came out of the love a man can have for a man.  You've gotta be a little better because of it.	Ses02M-script01-04-01-3_M034.wav	04
Ses02F_impro07_M004	 Wow, that's...	Ses02F-impro07-07-01-M004.wav	07
Ses01F_impro02_F004	 There's people that have given more though, you know?	Ses01F-impro02-04-01-F004.wav	04
Ses01M_script01_1_M023	 To hell with that.	Ses01M-script01-05-01-1_M023.wav	05
Ses02F_impro06_M015	 But It's okay because now, you know, you'll just go on with your life and--	Ses02F-impro06-01-01-M015.wav	01
Ses03M_impro06_M022	 He's supposed to be my best friend.	Ses03M-impro06-04-01-M022.wav	04
Ses02F_impro07_F004	 So--	Ses02F-impro07-07-01-F004.wav	07
Ses04F_script03_2_F037	 Listen? Listen indeed.  I'm sick and tired of listening to you.  You damn sadistic bully.	Ses04F-script03-05-01-2_F037.wav	05
Ses04F_impro02_F006	 Do you think I want to leave you?	Ses04F-impro02-04-01-F006.wav	04
Ses04F_impro07_F040	 I am totally down with the ice cream.	Ses04F-impro07-07-01-F040.wav	07
Ses01M_script03_2_F030	 Not very funny darling.  Why don't you have some more brandy?	Ses01M-script03-05-01-2_F030.wav	05
Ses02F_script01_2_M005	 Well, so what?	Ses02F-script01-01-01-2_M005.wav	01
Ses01F_script02_1_M008	 Whose is it?	Ses01F-script02-01-01-1_M008.wav	01
Ses04F_script03_1_F006	 Behave exquisitely.	Ses04F-script03-07-01-1_F006.wav	07
Ses02F_script01_1_F037	 What about the business?  What the hell is this?	Ses02F-script01-05-01-1_F037.wav	05
Ses03F_impro04_M005	 You could. You could. We just--	Ses03F-impro04-01-01-M005.wav	01
Ses01M_impro02_F017	 Mm hmm.  We'll build a bunker and never come out.	Ses01M-impro02-04-01-F017.wav	04
Ses05M_impro06_M014	 You always think, you know when you were- you know when you were a little kid and you think something is gonna happen, like, it will all be better when I am older, you know?	Ses05M-impro06-04-01-M014.wav	04
Ses04M_impro08_M027	 if you ever come out to Montgomery, I mean, you know, just -- just call up, you know, call up the operator and I'll-- I'll be here. So, um.	Ses04M-impro08-01-01-M027.wav	01
Ses05F_script03_2_F040	 Oh, marry you again?  I must have been insane.  What was I thinking?  I mean, you're completely outrageous.	Ses05F-script03-05-01-2_F040.wav	05
Ses05F_impro04_M035	 Like- What's your ideal job?  What do you want to do?	Ses05F-impro04-01-01-M035.wav	01
Ses05F_script01_3_M017	 Oh Annie, we're going to live now.  I'm going to make you so happy.	Ses05F-script01-07-01-3_M017.wav	07
Ses03M_impro02_F023	 You said two years.	Ses03M-impro02-04-01-F023.wav	04
Ses02F_script01_1_F017	 I've got an idea, but what's the story?	Ses02F-script01-04-01-1_F017.wav	04
Ses02F_script03_2_F020	 Adders don't snap, they sting.	Ses02F-script03-05-01-2_F020.wav	05
Ses02M_impro05_F016	 Um, so.	Ses02M-impro05-01-01-F016.wav	01
Ses02M_script03_1_F002	 What are we going to do?	Ses02M-script03-07-01-1_F002.wav	07
Ses01M_impro06_F028	 Are there things you wish you'd done differently?	Ses01M-impro06-01-01-F028.wav	01
Ses04M_impro04_M021	 That's not true.  I take responsibility for my own actions.	Ses04M-impro04-01-01-M021.wav	01
Ses03F_impro07_F007	 I got--U.S.C.. I got- Yeah, I got the acceptance letter.	Ses03F-impro07-07-01-F007.wav	07
Ses03F_script03_2_M001	 I knew nothing of the sort. You took presents from him.	Ses03F-script03-05-01-2_M001.wav	05
Ses03M_impro06_M001	 alright.	Ses03M-impro06-04-01-M001.wav	04
Ses05M_impro08_M005	 Has somebody tried to pin your site?	Ses05M-impro08-01-01-M005.wav	01
Ses01F_impro05_F018	 Do you understand who my husband is?	Ses01F-impro05-05-01-F018.wav	05
Ses05M_impro05_F021	 [LAUGHTER] Okay.  Hold on.	Ses05M-impro05-01-01-F021.wav	01
Ses05M_impro05_F018	 Yeah I mean, Your bag might have been confiscated because it's --	Ses05M-impro05-01-01-F018.wav	01
Ses05F_script01_1_M007	 I don't know the meaning of it.  But I know one thing mom did.  We made a terrible mistake with dad.	Ses05F-script01-04-01-1_M007.wav	04
Ses02F_impro05_F000	 Hi, um, excuse me, I believe that the airline lost my baggage.	Ses02F-impro05-01-01-F000.wav	01
Ses02F_impro08_F020	 Okay.  Great.  What time of the day would you like?	Ses02F-impro08-01-01-F020.wav	01
Ses03F_script01_3_M025	 Let's drive somewhere. I want to be alone with you.	Ses03F-script01-04-01-3_M025.wav	04
Ses03M_script01_1_M022	 Oh see then it's just not my business. God you infuriate me sometimes.  Isn't my business too if dad throws a fit?  Huh?  God you have such a talent for ignoring things.	Ses03M-script01-05-01-1_M022.wav	05
Ses02F_script01_3_F009	 from her point of view, why else would I come?	Ses02F-script01-04-01-3_F009.wav	04
Ses05F_impro07_F007	 Well, I don't want to, I don't want to live with my mom.	Ses05F-impro07-01-01-F007.wav	01
Ses03F_impro03_F006	 And I'm like oh, he went to the- -the bathroom, but he didn't tell me, I didn't even notice him leaving. And all of a sudden, I swear to God, I'm sitting there and-	Ses03F-impro03-07-01-F006.wav	07
Ses01F_script01_2_F004	 It's got that about it.	Ses01F-script01-05-01-2_F004.wav	05
Ses01M_impro03_F020	 Yeah, at night.	Ses01M-impro03-07-01-F020.wav	07
Ses02F_impro06_F010	 He did a lot.  But--	Ses02F-impro06-04-01-F010.wav	04
Ses04F_script01_1_F040	 Alright but don't think that way	Ses04F-script01-05-01-1_F040.wav	05
Ses04F_script01_3_M032	 I put them in my pocket. that's only a little thing but these are the kind of guys I had.	Ses04F-script01-04-01-3_M032.wav	04
Ses02M_impro08_M000	 All right. Customer service this is Steve.	Ses02M-impro08-01-01-M000.wav	01
Ses03F_impro07_F014	 Yeah, why not.	Ses03F-impro07-07-01-F014.wav	07
Ses01F_script02_1_M016	 God, I'm so excited, I'm like a kid.  I can't believe I got out of the house with my fly zipped up.	Ses01F-script02-07-01-1_M016.wav	07
Ses05M_script01_1_M017	 I'm going to ask her to marry me.	Ses05M-script01-01-01-1_M017.wav	01
Ses03F_script03_2_M011	 I'll have a little, I think.	Ses03F-script03-01-01-2_M011.wav	01
Ses01F_script02_2_F008	 For God- Grow up, Augie.  The fish are not going to arrive.	Ses01F-script02-05-01-2_F008.wav	05
Ses04F_script01_2_F006	 No, line.	Ses04F-script01-05-01-2_F006.wav	05
Ses02F_impro07_F007	 I know.  I know. And we'll all get to hang out.  And I'm--even though we'll be at like at different parts of the city, we can still, like...	Ses02F-impro07-07-01-F007.wav	07
Ses02M_script02_1_M039	 Just all as one. This little time sensitive firecracker, instinctual firecracker in their body just went off and all as one they turned and formed a line as long the California coast and started swimming. They're swimming right now as if that's the only thing that matters.	Ses02M-script02-07-01-1_M039.wav	07
Ses05F_impro03_F000	 Okay, so big news.	Ses05F-impro03-07-01-F000.wav	07
Ses05F_impro08_F001	 Okay.	Ses05F-impro08-01-01-F001.wav	01
Ses03F_script03_1_M022	 Remember that awful scene we had in Venice?	Ses03F-script03-07-01-1_M022.wav	07
Ses04M_script02_1_F017	 Yes.	Ses04M-script02-05-01-1_F017.wav	05
Ses04M_script01_2_M019	 What have I got to hide?  What the hell is the matter with you, Kate?	Ses04M-script01-05-01-2_M019.wav	05
Ses04M_script03_2_F000	 That was the first time you ever hit me.	Ses04M-script03-05-01-2_F000.wav	05
Ses02M_impro02_F003	 but	Ses02M-impro02-04-01-F003.wav	04
Ses05F_script02_1_F001	 What flashlight?	Ses05F-script02-01-01-1_F001.wav	01
Ses05M_script03_1_F031	 You knew there was nothing in that.	Ses05M-script03-01-01-1_F031.wav	01
Ses01M_impro02_F013	 You're going with the same ones?	Ses01M-impro02-04-01-F013.wav	04
Ses05M_impro07_M001	 I got it.  I got accepted to U.S.C..	Ses05M-impro07-07-01-M001.wav	07
Ses04F_script03_2_M042	 You're not going like this.	Ses04F-script03-05-01-2_M042.wav	05
Ses02M_script03_2_M045	 Shut up.	Ses02M-script03-05-01-2_M045.wav	05
Ses05M_script02_2_F032	 Yes.  Don't you know that? I mean, You're probably the one you wishes you were with somebody else, somebody who didn't take everything so hard and who knew how to enjoy herself.	Ses05M-script02-04-01-2_F032.wav	04
Ses03M_impro05a_F028	 What is your name?	Ses03M-impro05a-05-01-F028.wav	05
Ses05M_impro05_F001	 How long ago was that?	Ses05M-impro05-01-01-F001.wav	01
Ses04F_impro03_M047	 I don't know.  Okay.  I mean gosh.  There's just- look there's a lot of pressure in getting married, okay.	Ses04F-impro03-01-01-M047.wav	01
Ses01M_script02_1_M023	 That's my point too.	Ses01M-script02-01-01-1_M023.wav	01
Ses04F_impro04_M028	 Well you've got to start somewhere.  I mean-	Ses04F-impro04-01-01-M028.wav	01
Ses02M_impro03_F001	 Finally did what?	Ses02M-impro03-07-01-F001.wav	07
Ses01M_impro03_M022	 I'll make her pay for that.  I hear she's like totally wealthy. She's like royalty- --or something like and- --whatever like removed or something but yeah.	Ses01M-impro03-07-01-M022.wav	07
Ses03M_impro03_F036	 You still act like a boy.  And men take a lot longer to grow----I will tell you.	Ses03M-impro03-01-01-F036.wav	01
Ses01M_impro06_M003	 [BREATHING] Umm.	Ses01M-impro06-04-01-M003.wav	04
Ses02F_impro06_F002	 It seemed like he had a little bit longer.  Like just last week, he was doing was so well.	Ses02F-impro06-04-01-F002.wav	04
Ses05M_impro07_M041	 It's just you know a dream come true.  How could you not be excited about a dream come true?	Ses05M-impro07-07-01-M041.wav	07
Ses03F_impro01_M001	 Oh, um-	Ses03F-impro01-01-01-M001.wav	01
Ses03F_script01_3_M030	 Well, I lost them.	Ses03F-script01-04-01-3_M030.wav	04
Ses05M_script02_1_M008	 I can't believe I forgot.I'm like a little kid.  I'm surprised I made it out of the house with my fly zipped. Oh, [LAUGHTER]	Ses05M-script02-07-01-1_M008.wav	07
Ses05F_script03_2_M008	 Well, that's a nice point of view I must say.	Ses05F-script03-05-01-2_M008.wav	05
Ses02F_impro03_F001	 Well, guess.  Guess, guess, guess, guess.	Ses02F-impro03-07-01-F001.wav	07
Ses02M_impro02_M013	 there's people that thought it was the right thing to do so now we have to- we have to do what we have to do for our country	Ses02M-impro02-04-01-M013.wav	04
Ses05M_impro08_M002	 You've lost your connection.	Ses05M-impro08-01-01-M002.wav	01
Ses01F_script01_2_F009	 Nobody in this house dares take away her faith, Joe.  You know strangers might, but not his father, not his brother.	Ses01F-script01-05-01-2_F009.wav	05
Ses02M_impro08_M025	 Yes, um but  for- for that- for that charge we will need you to send something in but we can get you processed immediately for this, for this, for this new card. It still goes to the same address, right?	Ses02M-impro08-01-01-M025.wav	01
Ses01F_impro05_M014	 No, no.	Ses01F-impro05-01-01-M014.wav	01
Ses03F_impro02_F029	 Look, I need you to be strong for me. 'Cause I can't be the only one that's strong right now, really, I--	Ses03F-impro02-04-01-F029.wav	04
Ses03F_impro02_F035	 And- And then I'll stop working and- I'll stay home with the baby.	Ses03F-impro02-04-01-F035.wav	04
Ses04F_script02_1_M023	 This is the big night for these guys.  Life's last orgy.	Ses04F-script02-07-01-1_M023.wav	07
Ses05M_script01_1_M036	 Yes.  On this, I would.	Ses05M-script01-05-01-1_M036.wav	05
Ses03F_script02_1_M017	 Do you want my jacket?	Ses03F-script02-01-01-1_M017.wav	01
Ses01M_impro03_M014	 Yeah.  Make her like open the bank account and stuff too.	Ses01M-impro03-01-01-M014.wav	01
Ses05M_script03_1_F004	 It was bound to happen sooner or later.	Ses05M-script03-07-01-1_F004.wav	07
Ses03F_impro04_M001	 No, don't think like that.	Ses03F-impro04-01-01-M001.wav	01
Ses03M_impro05b_F009	 Like the luggage, the luggage on the flight.	Ses03M-impro05b-01-01-F009.wav	01
Ses04F_script01_1_M005	 I could hear him right through the floor of my room.	Ses04F-script01-04-01-1_M005.wav	04
Ses03M_impro02_F032	 Honey I can't do it anymore.	Ses03M-impro02-04-01-F032.wav	04
Ses03M_script03_2_M033	 Oh, thanks.  I think I will.	Ses03M-script03-05-01-2_M033.wav	05
Ses02F_script03_1_M025	 You remember that awful scene we had in Venice?	Ses02F-script03-01-01-1_M025.wav	01
Ses03M_script03_2_F025	 They sting.	Ses03M-script03-05-01-2_F025.wav	05
Ses03F_script01_2_F001	 She's been in New York for three-and-a-half years. She don't just suddenly come and-	Ses03F-script01-05-01-2_F001.wav	05
Ses02M_impro05_M016	 Theft? Don't you know like all these people that are work - you keep like an eye on them, how can they get away with-	Ses02M-impro05-05-01-M016.wav	05
Ses01F_script02_1_M038	 Just all at once, they turned and they formed this line as long as the California coast.  And some instinctual little firecracker went off in their bodies and they all just turned as one and started swimming.	Ses01F-script02-07-01-1_M038.wav	07
Ses05M_impro05_F000	 Hmm. Hmm.	Ses05M-impro05-01-01-F000.wav	01
Ses02M_script02_1_F020	 That's the wind.	Ses02M-script02-01-01-1_F020.wav	01
Ses04F_impro01_F016	 This is your job is to help people like me who need to get a new license.	Ses04F-impro01-05-01-F016.wav	05
Ses01M_impro07_F014	 Okay. That would be way too much of a commute you can't do that. Especially- I know especially from--I don't know, what I was going to say, I don't know.	Ses01M-impro07-07-01-F014.wav	07
Ses05M_impro04_F011	 Well, I don't really know.  I don't I don't know you in like a job situation, so.	Ses05M-impro04-01-01-F011.wav	01
Ses04M_script01_1_F028	 The trouble is, you don't see enough women.  You never did.	Ses04M-script01-01-01-1_F028.wav	01
Ses03F_impro08_F011	 Do you have a land line, sir?	Ses03F-impro08-01-01-F011.wav	01
Ses03M_script02_2_M020	 It was in the car right?  Driving past the Knickerbocker Liquor Locker...	Ses03M-script02-01-01-2_M020.wav	01
Ses03F_script03_1_M007	 things that should matter dreadfully don't seem to matter at all when one's happy, do they?	Ses03F-script03-07-01-1_M007.wav	07
Ses02F_impro03_F004	 I'm so excited.	Ses02F-impro03-07-01-F004.wav	07
Ses03F_script02_1_M000	 Hey, what time is it? They're supposed to run around midnight, right? God, this is great, isn't it?	Ses03F-script02-07-01-1_M000.wav	07
Ses05F_impro08_M018	 Did they take-	Ses05F-impro08-01-01-M018.wav	01
Ses01F_impro05_M027	 With the amount of--	Ses01F-impro05-01-01-M027.wav	01
Ses05F_impro04_M037	 Everyone wants to be a working actor, but they all work at something else.	Ses05F-impro04-01-01-M037.wav	01
Ses02F_impro05_M003	 You know, I mean, there's a lot of things that go on under the plane and sometimes, you know, that kind of things happen.	Ses02F-impro05-01-01-M003.wav	01
Ses01F_script02_2_F036	 I didn't say that.	Ses01F-script02-04-01-2_F036.wav	04
Ses01M_script02_2_M043	 Maybe if you were with somebody else too?	Ses01M-script02-04-01-2_M043.wav	04
Ses05F_impro04_M033	 Do they give you any specifics as to why they didn't go with you?	Ses05F-impro04-01-01-M033.wav	01
Ses05F_impro08_F028	 six four nine four	Ses05F-impro08-01-01-F028.wav	01
Ses03M_script03_2_M032	 We might be able to bring up a splendid little debate about this intemperate tots.	Ses03M-script03-05-01-2_M032.wav	05
Ses04M_impro01_F001	 Okay, um.  Do you have your photo ID with you?	Ses04M-impro01-01-01-F001.wav	01
Ses05M_impro03_F006	 uh-huh	Ses05M-impro03-01-01-F006.wav	01
Ses04F_impro05_F010	 Yeah, well that's got everything I have in it.	Ses04F-impro05-05-01-F010.wav	05
Ses01M_impro07_M020	 Yeah, well I doubt [GARBAGE] ping pong [GARBAGE]	Ses01M-impro07-01-01-M020.wav	01
Ses03F_impro06_M009	 Trying to have a baby.	Ses03F-impro06-04-01-M009.wav	04
Ses05F_impro02_F028	 I know.	Ses05F-impro02-04-01-F028.wav	04
Ses03F_script01_1_M005	 I could hear it right through the floor.	Ses03F-script01-01-01-1_M005.wav	01
Ses01M_script01_3_M025	 you know over seas I was in command of the company?	Ses01M-script01-04-01-3_M025.wav	04
Ses02F_impro03_F028	 It's so girly.  I don't even know how to like--It's so weird, but it'll be fun.  My mom will love to be like--she'll get so into it, I'm sure.	Ses02F-impro03-07-01-F028.wav	07
Ses05M_impro07_M006	 oh-	Ses05M-impro07-07-01-M006.wav	07
Ses04F_script02_2_F021	 right into my ear so that I could hear them as much as- so that I could feel them as much as hear them.	Ses04F-script02-04-01-2_F021.wav	04
Ses03M_script01_1_M021	 Okay.  So then it's alright.  I'll go ahead with it.	Ses03M-script01-01-01-1_M021.wav	01
